<?xml version="1.0" encoding="UTF-8"?>
<candies xmlns:xsi="http://www.w3.org/2001/XMLSchema-instance"
          xmlns="http://www.example.com/candies"
          xsi:schemaLocation="http://www.example.com/candies candies.xsd">
    <candy id="101" name="Alenka" expiration-date="2022-07">
        <energy>100</energy>
        <type>chocolate</type>
        <ingredients>
            <ingredient name="water"/>
            <ingredient name="sugar" quantity="10"/>
            <ingredient name="fructose" quantity="3"/>
            <ingredient name="cocoa" quantity="20"/>
            <ingredient name="vanillin" quantity="2"/>
        </ingredients>
        <value>
            <proteins>8</proteins>
            <fats>36</fats>
            <carbohydrates>52</carbohydrates>
        </value>
        <production>Red October</production>
        <filling>true</filling>
    </candy>
</candies>